{
  "$schema": "https://json-schema.org/draft/2020-12/schema",
  "$id": "https://raw.githubusercontent.com/yzm1/boundver/v0.16.0/spec/semantic-provider-proposal.schema.json",
  "title": "boundver semantic provider proposal assurance record",
  "type": "object",
  "required": [
    "schema_version",
    "proposal",
    "status",
    "implementation_allowed",
    "semantic_provider_work_allowed",
    "documents",
    "threats",
    "controls",
    "verifications",
    "red_team",
    "review_requirements",
    "open_findings",
    "release_gates",
    "references"
  ],
  "properties": {
    "$schema": {"type": "string"},
    "schema_version": {"const": 2},
    "proposal": {"const": "boundver-semantic-provider-system/v1"},
    "status": {
      "enum": ["draft", "review-ready", "accepted", "rejected", "superseded"]
    },
    "implementation_allowed": {"type": "boolean"},
    "semantic_provider_work_allowed": {"type": "boolean"},
    "documents": {
      "type": "object",
      "required": ["rfc", "threat_model"],
      "properties": {
        "rfc": {"$ref": "#/$defs/repositoryPath"},
        "threat_model": {"$ref": "#/$defs/repositoryPath"}
      },
      "additionalProperties": false
    },
    "threats": {
      "type": "array",
      "minItems": 1,
      "items": {"$ref": "#/$defs/threat"}
    },
    "controls": {
      "type": "array",
      "minItems": 1,
      "items": {"$ref": "#/$defs/control"}
    },
    "verifications": {
      "type": "array",
      "minItems": 1,
      "items": {"$ref": "#/$defs/verification"}
    },
    "red_team": {
      "type": "object",
      "required": ["status", "rounds", "residual_risks_accepted"],
      "properties": {
        "status": {"enum": ["pending", "passed", "failed"]},
        "rounds": {
          "type": "array",
          "items": {"$ref": "#/$defs/redTeamRound"}
        },
        "residual_risks_accepted": {"type": "boolean"}
      },
      "additionalProperties": false
    },
    "review_requirements": {
      "$ref": "#/$defs/reviewRequirements"
    },
    "open_findings": {
      "type": "array",
      "items": {"$ref": "#/$defs/finding"}
    },
    "release_gates": {
      "type": "object",
      "required": ["v0.17.0"],
      "properties": {
        "v0.17.0": {"$ref": "#/$defs/releaseGate"}
      },
      "additionalProperties": false
    },
    "references": {
      "type": "array",
      "minItems": 1,
      "items": {
        "type": "string",
        "pattern": "^https://"
      }
    }
  },
  "additionalProperties": false,
  "$defs": {
    "repositoryPath": {
      "type": "string",
      "minLength": 1,
      "pattern": "^(?!/)(?![A-Za-z]:)(?!.*\\\\)(?!.*(?:^|/)\\.{1,2}(?:/|$)).+$"
    },
    "threat": {
      "type": "object",
      "required": ["id", "title", "severity", "controls", "verifications"],
      "properties": {
        "id": {"type": "string", "pattern": "^SPT-[0-9]{3}$"},
        "title": {"type": "string", "minLength": 1},
        "severity": {"enum": ["critical", "high", "medium", "low"]},
        "controls": {
          "type": "array",
          "minItems": 1,
          "uniqueItems": true,
          "items": {"type": "string", "pattern": "^SPC-[0-9]{3}$"}
        },
        "verifications": {
          "type": "array",
          "minItems": 1,
          "uniqueItems": true,
          "items": {"type": "string", "pattern": "^SPV-[0-9]{3}$"}
        }
      },
      "additionalProperties": false
    },
    "control": {
      "type": "object",
      "required": ["id", "title", "kinds", "threats", "verifications"],
      "properties": {
        "id": {"type": "string", "pattern": "^SPC-[0-9]{3}$"},
        "title": {"type": "string", "minLength": 1},
        "kinds": {
          "type": "array",
          "minItems": 1,
          "uniqueItems": true,
          "items": {"enum": ["preventive", "detective", "recovery"]}
        },
        "threats": {
          "type": "array",
          "minItems": 1,
          "uniqueItems": true,
          "items": {"type": "string", "pattern": "^SPT-[0-9]{3}$"}
        },
        "verifications": {
          "type": "array",
          "minItems": 1,
          "uniqueItems": true,
          "items": {"type": "string", "pattern": "^SPV-[0-9]{3}$"}
        }
      },
      "additionalProperties": false
    },
    "verification": {
      "type": "object",
      "required": ["id", "title", "phase", "status", "evidence"],
      "properties": {
        "id": {"type": "string", "pattern": "^SPV-[0-9]{3}$"},
        "title": {"type": "string", "minLength": 1},
        "phase": {"enum": ["proposal", "implementation", "provider", "release"]},
        "status": {"enum": ["planned", "passed", "failed", "not-applicable"]},
        "evidence": {
          "type": "array",
          "items": {"type": "string", "minLength": 1}
        }
      },
      "additionalProperties": false
    },
    "redTeamRound": {
      "type": "object",
      "required": ["id", "scope", "status", "findings", "evidence"],
      "properties": {
        "id": {"type": "string", "pattern": "^RTR-[0-9]{3}$"},
        "scope": {"type": "string", "minLength": 1},
        "status": {"enum": ["planned", "passed", "failed"]},
        "findings": {
          "type": "array",
          "uniqueItems": true,
          "items": {"type": "string", "pattern": "^RTF-[0-9]{3}$"}
        },
        "evidence": {
          "type": "array",
          "items": {"type": "string", "minLength": 1}
        }
      },
      "additionalProperties": false
    },
    "reviewRequirements": {
      "type": "object",
      "required": [
        "repository",
        "repository_id",
        "repository_owner_id",
        "base_branch",
        "reviewer_authority",
        "review_roster_gist_id",
        "review_roster_gist_node_id",
        "review_roster_gist_description",
        "review_roster_gist_filename",
        "distinct_roster_reviewers_required",
        "owner_exclusive_repository_collaborators_required",
        "owner_exclusive_mutation_authority_attestation_required",
        "minimum_non_author_reviews",
        "maximum_review_age_days",
        "security_review_required",
        "product_review_required",
        "security_review_marker",
        "product_review_marker",
        "reviewer_independence_attestation",
        "exact_commit_required",
        "resolved_threads_required",
        "no_pending_review_requests",
        "authoritative_audit"
      ],
      "properties": {
        "repository": {"const": "yzm1/boundver"},
        "repository_id": {"const": 1226008327},
        "repository_owner_id": {"const": 22440724},
        "base_branch": {"const": "main"},
        "reviewer_authority": {"const": "github-account-owned-public-gist/v1"},
        "review_roster_gist_id": {"const": "0caedb798d168b974f9d9fb63c377f73"},
        "review_roster_gist_node_id": {"const": "G_kwDOAVZrFNoAIDBjYWVkYjc5OGQxNjhiOTc0ZjlkOWZiNjNjMzc3Zjcz"},
        "review_roster_gist_description": {"const": "boundver semantic-provider independent reviewer roster"},
        "review_roster_gist_filename": {"const": "semantic-provider-review-roster.txt"},
        "distinct_roster_reviewers_required": {"const": true},
        "owner_exclusive_repository_collaborators_required": {"const": true},
        "owner_exclusive_mutation_authority_attestation_required": {"const": true},
        "minimum_non_author_reviews": {"const": 2},
        "maximum_review_age_days": {"const": 90},
        "security_review_required": {"const": true},
        "product_review_required": {"const": true},
        "security_review_marker": {"const": "semantic-provider-security-review/v1"},
        "product_review_marker": {"const": "semantic-provider-product-review/v1"},
        "reviewer_independence_attestation": {"const": "Independent-reviewer: confirmed"},
        "exact_commit_required": {"const": true},
        "resolved_threads_required": {"const": true},
        "no_pending_review_requests": {"const": true},
        "authoritative_audit": {"const": "scripts/audit_semantic_provider_proposal.py"}
      },
      "additionalProperties": false
    },
    "finding": {
      "type": "object",
      "required": ["id", "severity", "title", "owner", "disposition"],
      "properties": {
        "id": {"type": "string", "pattern": "^RTF-[0-9]{3}$"},
        "severity": {"enum": ["critical", "high", "medium", "low"]},
        "title": {"type": "string", "minLength": 1},
        "owner": {"type": "string", "minLength": 1},
        "disposition": {"enum": ["open", "accepted", "closed"]},
        "rationale": {"type": "string"},
        "expires": {"type": "string", "format": "date"},
        "compensating_controls": {
          "type": "array",
          "minItems": 1,
          "uniqueItems": true,
          "items": {"type": "string", "pattern": "^SPC-[0-9]{3}$"}
        },
        "evidence": {
          "type": "array",
          "minItems": 1,
          "items": {"type": "string", "minLength": 1}
        }
      },
      "allOf": [
        {
          "if": {"properties": {"disposition": {"const": "accepted"}}},
          "then": {
            "required": ["rationale", "expires", "compensating_controls", "evidence"]
          }
        },
        {
          "if": {"properties": {"disposition": {"const": "closed"}}},
          "then": {"required": ["rationale", "evidence"]}
        }
      ],
      "additionalProperties": false
    },
    "releaseGate": {
      "type": "object",
      "required": [
        "repository",
        "repository_id",
        "repository_owner_id",
        "base_branch",
        "reviewer_authority",
        "review_roster_gist_id",
        "review_roster_gist_node_id",
        "review_roster_gist_description",
        "review_roster_gist_filename",
        "distinct_roster_reviewers_required",
        "owner_exclusive_repository_collaborators_required",
        "owner_exclusive_mutation_authority_attestation_required",
        "evidence_source",
        "candidate_identity",
        "minimum_non_author_reviews",
        "maximum_review_age_days",
        "security_review_required",
        "product_review_required",
        "security_review_marker",
        "product_review_marker",
        "reviewer_independence_attestation",
        "required_attestations",
        "exact_commit_required",
        "exact_tree_required",
        "resolved_threads_required",
        "no_pending_review_requests",
        "authoritative_audit"
      ],
      "properties": {
        "repository": {"const": "yzm1/boundver"},
        "repository_id": {"const": 1226008327},
        "repository_owner_id": {"const": 22440724},
        "base_branch": {"const": "main"},
        "reviewer_authority": {"const": "github-account-owned-public-gist/v1"},
        "review_roster_gist_id": {"const": "0caedb798d168b974f9d9fb63c377f73"},
        "review_roster_gist_node_id": {"const": "G_kwDOAVZrFNoAIDBjYWVkYjc5OGQxNjhiOTc0ZjlkOWZiNjNjMzc3Zjcz"},
        "review_roster_gist_description": {"const": "boundver semantic-provider independent reviewer roster"},
        "review_roster_gist_filename": {"const": "semantic-provider-review-roster.txt"},
        "distinct_roster_reviewers_required": {"const": true},
        "owner_exclusive_repository_collaborators_required": {"const": true},
        "owner_exclusive_mutation_authority_attestation_required": {"const": true},
        "evidence_source": {"const": "github-exact-tree-review/v1"},
        "candidate_identity": {"const": "reviewed-head-tree-equals-release-tree"},
        "minimum_non_author_reviews": {"type": "integer", "minimum": 2},
        "maximum_review_age_days": {"const": 14},
        "security_review_required": {"const": true},
        "product_review_required": {"const": true},
        "security_review_marker": {"const": "semantic-provider-v0.17-release-review/v1"},
        "product_review_marker": {"const": "semantic-provider-v0.17-product-review/v1"},
        "reviewer_independence_attestation": {"const": "Independent-reviewer: confirmed"},
        "required_attestations": {
          "type": "array",
          "minItems": 6,
          "maxItems": 6,
          "uniqueItems": true,
          "prefixItems": [
            {"const": "Full-source-bug-scan: passed"},
            {"const": "Full-issue-audit: passed"},
            {"const": "Full-security-scan: passed"},
            {"const": "All-blockers: closed"},
            {"const": "Supported-platforms: passed"},
            {"const": "Publication-gates: passed"}
          ],
          "items": false
        },
        "exact_commit_required": {"const": true},
        "exact_tree_required": {"const": true},
        "resolved_threads_required": {"const": true},
        "no_pending_review_requests": {"const": true},
        "authoritative_audit": {"const": "scripts/audit_semantic_provider_proposal.py"}
      },
      "additionalProperties": false
    }
  }
}
