{
  "$schema": "spec/semantic-provider-proposal.schema.json",
  "schema_version": 2,
  "proposal": "boundver-semantic-provider-system/v1",
  "status": "review-ready",
  "implementation_allowed": false,
  "semantic_provider_work_allowed": false,
  "documents": {
    "rfc": "docs/design/semantic-provider-rfc.md",
    "threat_model": "docs/design/semantic-provider-threat-model.md"
  },
  "threats": [
    {"id": "SPT-001", "title": "Repository-controlled activation", "severity": "critical", "controls": ["SPC-001", "SPC-002", "SPC-004"], "verifications": ["SPV-004", "SPV-017"]},
    {"id": "SPT-002", "title": "Ambient discovery or module shadowing", "severity": "critical", "controls": ["SPC-003", "SPC-006", "SPC-021"], "verifications": ["SPV-005", "SPV-011"]},
    {"id": "SPT-003", "title": "Malicious or compromised artifact", "severity": "critical", "controls": ["SPC-002", "SPC-007", "SPC-016", "SPC-021", "SPC-023", "SPC-041"], "verifications": ["SPV-010", "SPV-012", "SPV-027"]},
    {"id": "SPT-004", "title": "Secret or network exfiltration", "severity": "critical", "controls": ["SPC-007", "SPC-008", "SPC-009"], "verifications": ["SPV-006", "SPV-017"]},
    {"id": "SPT-005", "title": "Filesystem or repository mutation", "severity": "critical", "controls": ["SPC-007", "SPC-008", "SPC-009", "SPC-011"], "verifications": ["SPV-006", "SPV-030"]},
    {"id": "SPT-006", "title": "Host process takeover or termination", "severity": "critical", "controls": ["SPC-006", "SPC-008", "SPC-010"], "verifications": ["SPV-006", "SPV-030"]},
    {"id": "SPT-007", "title": "Resource exhaustion", "severity": "high", "controls": ["SPC-014", "SPC-027", "SPC-028"], "verifications": ["SPV-007", "SPV-008", "SPV-016"]},
    {"id": "SPT-008", "title": "Protocol parser corruption or allocation attack", "severity": "high", "controls": ["SPC-027", "SPC-028"], "verifications": ["SPV-007", "SPV-008"]},
    {"id": "SPT-009", "title": "Source-scope confused deputy", "severity": "high", "controls": ["SPC-011", "SPC-012"], "verifications": ["SPV-004", "SPV-006"]},
    {"id": "SPT-010", "title": "Nondeterministic platform or parser output", "severity": "high", "controls": ["SPC-016", "SPC-018", "SPC-019"], "verifications": ["SPV-009", "SPV-016"]},
    {"id": "SPT-011", "title": "Identity downgrade or replay", "severity": "high", "controls": ["SPC-016", "SPC-019", "SPC-020"], "verifications": ["SPV-010", "SPV-019"]},
    {"id": "SPT-012", "title": "Artifact replacement or TOCTOU", "severity": "critical", "controls": ["SPC-021", "SPC-026"], "verifications": ["SPV-011", "SPV-013"]},
    {"id": "SPT-013", "title": "Namespace or trust-label spoofing", "severity": "high", "controls": ["SPC-017", "SPC-024", "SPC-033"], "verifications": ["SPV-012", "SPV-021"]},
    {"id": "SPT-014", "title": "Diagnostic disclosure or CI injection", "severity": "high", "controls": ["SPC-015", "SPC-027"], "verifications": ["SPV-015", "SPV-017"]},
    {"id": "SPT-015", "title": "Cache poisoning or incomplete identity", "severity": "high", "controls": ["SPC-016", "SPC-025", "SPC-029"], "verifications": ["SPV-014", "SPV-019"]},
    {"id": "SPT-016", "title": "Repository policy self-authorization", "severity": "high", "controls": ["SPC-001", "SPC-002"], "verifications": ["SPV-004", "SPV-017"]},
    {"id": "SPT-017", "title": "Dependency, build, index, or publisher compromise", "severity": "critical", "controls": ["SPC-021", "SPC-022", "SPC-023", "SPC-025", "SPC-034"], "verifications": ["SPV-012", "SPV-020", "SPV-022"]},
    {"id": "SPT-018", "title": "Sandbox or runtime escape", "severity": "critical", "controls": ["SPC-007", "SPC-008", "SPC-009", "SPC-010", "SPC-023", "SPC-027"], "verifications": ["SPV-006", "SPV-022", "SPV-027"]},
    {"id": "SPT-019", "title": "Offline execution of a revoked identity", "severity": "high", "controls": ["SPC-020", "SPC-025"], "verifications": ["SPV-019", "SPV-028"]},
    {"id": "SPT-020", "title": "Partial or truncated output accepted", "severity": "high", "controls": ["SPC-013", "SPC-014", "SPC-028"], "verifications": ["SPV-007", "SPV-030"]},
    {"id": "SPT-021", "title": "Dynamic-language under-approximation", "severity": "high", "controls": ["SPC-014", "SPC-018", "SPC-019", "SPC-031"], "verifications": ["SPV-016", "SPV-026"]},
    {"id": "SPT-022", "title": "Compatibility overclaim", "severity": "high", "controls": ["SPC-031", "SPC-033"], "verifications": ["SPV-003", "SPV-021"]},
    {"id": "SPT-023", "title": "Install path, link, case, or archive tampering", "severity": "high", "controls": ["SPC-022", "SPC-026"], "verifications": ["SPV-013"]},
    {"id": "SPT-024", "title": "Concurrent cross-repository state confusion", "severity": "high", "controls": ["SPC-008", "SPC-026", "SPC-030"], "verifications": ["SPV-014", "SPV-030"]},
    {"id": "SPT-025", "title": "Platform sandbox disparity", "severity": "high", "controls": ["SPC-009", "SPC-010", "SPC-033"], "verifications": ["SPV-006", "SPV-009"]},
    {"id": "SPT-026", "title": "Unsafe native fallback", "severity": "critical", "controls": ["SPC-006", "SPC-010", "SPC-032"], "verifications": ["SPV-005", "SPV-018"]},
    {"id": "SPT-027", "title": "Network install or mutable resolution during analysis", "severity": "critical", "controls": ["SPC-003", "SPC-005", "SPC-021", "SPC-022"], "verifications": ["SPV-005", "SPV-025"]},
    {"id": "SPT-028", "title": "First-party maintainer or release compromise", "severity": "critical", "controls": ["SPC-002", "SPC-023", "SPC-025", "SPC-033", "SPC-034"], "verifications": ["SPV-012", "SPV-020", "SPV-022"]},
    {"id": "SPT-029", "title": "Parser differential or unsupported grammar drift", "severity": "high", "controls": ["SPC-018", "SPC-019", "SPC-031"], "verifications": ["SPV-009", "SPV-016", "SPV-026"]},
    {"id": "SPT-030", "title": "Provenance or conformance mistaken for authorization", "severity": "high", "controls": ["SPC-002", "SPC-023", "SPC-024"], "verifications": ["SPV-012", "SPV-021"]},
    {"id": "SPT-031", "title": "Approval fatigue and dangerous trust UX", "severity": "medium", "controls": ["SPC-002", "SPC-022", "SPC-033"], "verifications": ["SPV-021", "SPV-028"]},
    {"id": "SPT-032", "title": "Aggregate declaration or diagnostic denial of service", "severity": "high", "controls": ["SPC-027", "SPC-028"], "verifications": ["SPV-008", "SPV-023"]},
    {"id": "SPT-033", "title": "Clock, random, nonce, or timing side channel", "severity": "medium", "controls": ["SPC-007", "SPC-018", "SPC-028", "SPC-030"], "verifications": ["SPV-006", "SPV-009", "SPV-030"]},
    {"id": "SPT-034", "title": "Historical artifact disappearance", "severity": "medium", "controls": ["SPC-020", "SPC-021", "SPC-025"], "verifications": ["SPV-028"]},
    {"id": "SPT-035", "title": "License or compliance failure", "severity": "medium", "controls": ["SPC-023", "SPC-035"], "verifications": ["SPV-020", "SPV-029"]},
    {"id": "SPT-036", "title": "Identity-axis omission or semantic over-coupling", "severity": "high", "controls": ["SPC-016", "SPC-036"], "verifications": ["SPV-009", "SPV-010", "SPV-034"]},
    {"id": "SPT-037", "title": "Host policy spoofing, race, or replacement", "severity": "critical", "controls": ["SPC-002", "SPC-037", "SPC-040"], "verifications": ["SPV-004", "SPV-011", "SPV-031"]},
    {"id": "SPT-038", "title": "Provider option-schema abuse or divergence", "severity": "high", "controls": ["SPC-027", "SPC-028", "SPC-038"], "verifications": ["SPV-007", "SPV-008", "SPV-032"]},
    {"id": "SPT-039", "title": "Selected-source disclosure through provider output or metadata", "severity": "high", "controls": ["SPC-012", "SPC-015", "SPC-039", "SPC-041"], "verifications": ["SPV-015", "SPV-033", "SPV-036"]},
    {"id": "SPT-040", "title": "Stale, mutable, or over-privileged approval evidence", "severity": "high", "controls": ["SPC-033", "SPC-034", "SPC-040", "SPC-044", "SPC-045"], "verifications": ["SPV-021", "SPV-024", "SPV-035", "SPV-038"]},
    {"id": "SPT-041", "title": "Deterministic but semantically false provider output", "severity": "high", "controls": ["SPC-002", "SPC-019", "SPC-031", "SPC-041"], "verifications": ["SPV-016", "SPV-026", "SPV-036"]},
    {"id": "SPT-042", "title": "Pre-sandbox provider artifact or evidence decoding", "severity": "critical", "controls": ["SPC-008", "SPC-009", "SPC-021", "SPC-042"], "verifications": ["SPV-006", "SPV-011", "SPV-037"]},
    {"id": "SPT-043", "title": "Self-attested, stale, or unenforced semantic-provider release evidence", "severity": "critical", "controls": ["SPC-034", "SPC-040", "SPC-043", "SPC-045"], "verifications": ["SPV-024", "SPV-035", "SPV-038"]},
    {"id": "SPT-044", "title": "Fail-closed extraction drives operators to legacy native execution", "severity": "high", "controls": ["SPC-010", "SPC-014", "SPC-046", "SPC-047"], "verifications": ["SPV-039", "SPV-040"]},
    {"id": "SPT-045", "title": "Quarantined legacy trusted-native execution never retires", "severity": "high", "controls": ["SPC-032", "SPC-047"], "verifications": ["SPV-040"]},
    {"id": "SPT-046", "title": "Sole owner account becomes unavailable rather than compromised", "severity": "high", "controls": ["SPC-045", "SPC-048"], "verifications": ["SPV-041"]},
    {"id": "SPT-047", "title": "Parsing defect in gate code grants release authority", "severity": "medium", "controls": ["SPC-034", "SPC-040", "SPC-049"], "verifications": ["SPV-042"]},
    {"id": "SPT-048", "title": "Template-perfect approval satisfies the gate without review", "severity": "medium", "controls": ["SPC-033", "SPC-050"], "verifications": ["SPV-043"]},
    {"id": "SPT-049", "title": "Publicly named roster member is phished, compromised, or coerced", "severity": "medium", "controls": ["SPC-044", "SPC-051"], "verifications": ["SPV-044"]},
    {"id": "SPT-050", "title": "Runtime defect changes canonical output without a contract change", "severity": "medium", "controls": ["SPC-018", "SPC-019", "SPC-052"], "verifications": ["SPV-045"]},